attrs = {
    bcdUSB = 0x200
    bDeviceClass = 0x0
    bDeviceSubClass = 0x0
    bDeviceProtocol = 0x0
    bMaxPacketSize0 = 0x40
    idVendor = 0x1D6B
    idProduct = 0x104
    bcdDevice = 0x1
}

strings = (
    {
        lang = 0x409
        manufacturer = "Allwinner Inc."
        product = "Mangopi-MQ"
        serialnumber = "0123456789"
    }
)

functions = {
    acm_usb0 = {
        instance = "usb0"
        type = "acm"
    }

    ecm_usb0 = {
        instance = "usb0"
        type = "ecm"
    }
}

configs = (
    {
        id = 1
        name = "mangopi-mq"
        attrs = {
            bmAttributes = 0x80
            bMaxPower = 0x2
        }
        strings = (
            {
                lang = 0x409
                configuration = "Config id 1"
            } )
        functions = (
            {
                name = "acm.GS0"
                function = "acm_usb0"
            },
			{
                name = "ecm.usb0" 
                function = "ecm_usb0"
            }
        )
    }
)
